181	pos	This mouse's curvature makes it so that in order to get a comfortable grip, your pinky and ring finger are forced to hang off the side and drag on my desk
181	pos	I game a lot with this mouse, and so far it's held up great
181	neg	However, some days the left mouse button (lmb) and right mouse button (rmb) would just stop working properly
181	neg	If holding down the lmb, it would stutter and would stop shooting mid-spray
181	pos	_____________________PROS_____________________extremely customizable:Installing logitech G-hub is little to no hassle, and making macros makes using this mouse extremely fun
181	pos	visually satisfying:it looks sleek and, for lack of a better word, cool
181	pos	cool scroll button:you can toggle it between going by intervals or just flat-out spinning like a wheel
181	pos	Pretty useful for any tasks that require spamming inputs really quickly
181	neg	Point is, the g502 hero is one of the worse mice you can get from logitech
183	neg	When you are scrolling through things it tends to "jump" really far ahead or really far back and it is incredibly annoying
184	pos	I can easily recommend it to anyone who is looking for a nice gaming or regular mouse with additional comfort
185	pos	The Pros:The mouse itself is well built
185	pos	I love the dual mode scroll wheel as well
185	neg	The Cons:LG Hub software is garbage
185	neg	It installed but would not run on my Win 10 x64 PC
185	neg	I have tried re-installing several times without any success
185	neg	Instructions for the mouse are also quite poor
185	neg	The updated Logitech software is trash though
186	neg	Update: After about 6 months, this mouse has broken in some way that makes it unusable
186	neg	The sensor no longer tracks accurately and something as simple as clicking a link on a web page is nearly impossible due to the random movement it's adding to my motion
187	neg	Within a month my left mouse button developed issues that resulted in clicking when there is no input, clicks not registering when there is input, and double clicking when releasing the button
187	neg	My replacement mouse is already displaying the same symptoms of the first mouse
187	neg	Less than a month in and I get phantom clicks and unintended double clicks
187	neg	If you're looking to buy this for gaming, I recommend you look elsewhere
188	neg	I'm a huge Logitech fan but this one is a failure, pretty much anything with the name HERO from them is a ZERO
189	pos	This mouse has a solid build quality and is comfortable for any grip style
189	neg	The G502 is more on the heavy side for a mouse and I don't see a need to use any of the included weights
189	neg	The mass of this mouse could be an issue for some people, as they may notice some fatigue with constantly moving the mouse around
189	neg	Straightening it was simple enough and getting it to maintain a curve wasn't terribly hard
189	pos	Gaming and general usage so far have been great
189	pos	The sensor seems to work on just about any normal desk surface
190	pos	This is the best gaming mouse I have ever owned
190	pos	I love the software, buttons, and all the cool stuff you can do
190	pos	The top feature for me in particular is the scroll wheel, which with the press of a button lets you scroll freely instead of having it click in steps
190	pos	I can't go to any other mouse now since to my knowledge none have that feature, and makes me wonder why other brands haven't universally adopted the feature
191	pos	A fully programmable mouse with plenty of easy to reach buttons and a fun lighting scheme
191	pos	The embedded software is easy to use and low maintenance
191	pos	The mouse feels great and has simple weights that can be added to increase the heft
191	pos	Lots of buttons that can be programmed for intuitive use
191	neg	1 star off for the DPI buttons being to easy to click in between the left click and the back click
191	neg	So all of a sudden having your mouse speed up or slow down means you need to train yourself as to how you position your fingers
191	pos	Beyond that minor qualm, it's a great gaming mouse
192	neg	i have owned 3 g502 heros in the span of around 8 months with each one having the ending up with the same problem, the right click will begin to freak out; registering several clicks with a single press/hold
192	neg	this makes aiming down sights in games impossible and has remained a consistent issue through out all 3 of the g502 heros I've owned
192	neg	the first one started showing issues 4 months after i bought it
192	neg	same problem, Spazzy right click
192	neg	Spazzy right click
192	neg	honestly i don't really care to buy another mouse, or any product from Logitech going forward
192	neg	it's a shame too, because this used to be a really good mouse
193	pos	I own a lot of 'gaming' mice and this is the best of the bunch, worth every penny
193	neg	Only issues for me is this mouse is bigger than I expected (doesn't work for my wife, who has smaller hands) and I don't like the placement of the buttons by the thumb
193	pos	Other than that this mouse is outstanding
193	pos	Buttery smooth mouse movements
193	pos	I love the programmability of all the buttons, I love the apps, you can adjust settings to a fine level of detail
193	pos	The craftmanship/feel is top-notch
193	pos	There is a huge difference between this mouse and other cheaper gaming mice, definitely worth the price if it's in your budget
194	pos	* The cord is well thought out
194	pos	* Smooth as butter
194	pos	* Not just great for gaming, but also great for photo editing
194	pos	I'm always doing very tiny meticulous details & no other mouse has been good for that except this one
195	pos	The mouse itself is okay
195	neg	But the LED for the logo which you can change doesn't show pure white color
195	neg	It has blue tone of color added to the white color and comes out in this weird color
195	neg	No patterns or anything
195	neg	There's no pattern to choose even if you set it to one color
196	pos	However, I do love what I have customized with the settings for my regular day-to-day uses
196	pos	I like that I can add weights to the mouse
196	pos	The mouse is very responsive when I click around
196	pos	I did discover with this mouse the delight of having a scroll wheel that you can change how it scrolls
196	pos	Overall, an excellent mouse worth the price point of $40
196	neg	Don't pay over that
196	pos	Also, the pleasure of making the DPI setting faster than what the computer's DPI setting is maxed out at is great
197	neg	This is a garbage product, especially since its marketed to the FPS market
197	neg	This mouse has been a waste of time, money, and energy
197	neg	This is a garbage product
197	neg	I bought this mouse on March 29 of 2019, and its already having a lot of problems
197	neg	Sensor and most of the buttons work fine, but the left mouse button is not working properly
197	neg	It will either register a click, double click, no click, or 'unclick' when holding the button down
197	neg	Its sorely disappointing after only having it for a year
197	neg	Lots of people on tech forums are exacting the same frustrations
197	neg	Its an endemic issue for this particular model
198	pos	This mouse has on-board memory, which let's you save your configuration into it
198	pos	This is nice, since I don't want to always run the Logitech software, and it's good for when you use this mouse on another computer and don't have the software there
198	pos	With this mouse, it's so easy to change DPI with the DPI buttons
198	pos	It's a plus that it has on-board memory
198	pos	The side buttons are very tactile and feel really solid
198	pos	Also, the left and right mouse click buttons have very low travel time and feel very responsive
198	pos	I highly recommend this mouse for anyone that has big hands
199	neg	The build quality felt cheap especially when it came to the rattling of the mouse wheel
199	neg	Well since I procrastinated i had to use the g502 for the month and at the end of that month the left click feature started to double left click aprox
199	neg	To sum it up, the mouse is ugly, cheap, looks like it was made for a child gamer to beg his parents to buy for them bc it looks futuristic and has a high DPI
199	neg	BUT MOST IMPORTANTLY, the left click feature started failing after a little over 2 months of use
200	neg	Even if you adjust your sensitivity or add some of the weights the mouse comes with it is still really sensitive
200	neg	For the price, I would not buy it again
201	pos	The Logitech G502 in my opinion, is one of the best mice on the market you would ever get
201	pos	Every button on the mouse is programmable, but there are 5 extras that you can use for DPI or macros
201	pos	The ergonomics of the mouse are really good
201	pos	I can keep a really good grip on the mouse, and its textured rubber on the sides help with gripping
201	pos	I have quite large hands, and it still works flawlessly for me
201	pos	The mouse has on-board memory in case of no internet or if you need to play somewhere other than your house
201	pos	It only saves your RGB profiles and your sensitivity/DPI profiles
201	neg	This mouse cannot save macros onto the onboard memory
201	pos	The weight actually comes in advantage for me, as the weight of the mouse balances the speed at which I move it
201	neg	There is one issue that is common for the mouse, and that is the dreaded double-click issue that occurs with the G502
201	neg	The switches for the buttons may begin to register two presses
201	pos	Overall this mouse is a godsend, and is what made me use Logitech for all of my peripherals
202	pos	The Logitech Gaming Software is also amazing, no issues
202	neg	The only issue i have is a bit with the build quality its mostly plastic which is fine it has a decent feel for durability for a few months for me personally the side rubber grips get worn out so i end up buying a replacement
202	pos	But other than that i highly recommend it
203	neg	This product has a massive design flaw
203	neg	Logitech choose to go with cheap Chinese switches for this mouse and in a short period of time the switches are going to break
203	neg	This causes the LMB and RMB double-click for no reason, a lot of times while still holding the button down
204	pos	This is a great mouse
204	pos	I bought it for gaming, and it is ergonomic and the click of the mouse is just right, not too loud
204	pos	You can quickly interchange between DPI speed with a certain button, so it’s very convenient
204	pos	It has lots of buttons that make navigating your computer a breeze
204	pos	It also comes with some weights that you can put within the mouse to make it heavier or lighter based on what you like
204	pos	This mouse works for drag clicking and the scroll button can click sideways and downward, as well as two scrolling settings, you can make it scroll very fast and smoothly or have normal scrolling
204	pos	Definitely a great buy
205	pos	I was pleasantly surprised at how easily I was able to program keys to the mouse via their software which didn't take very long to download
205	pos	You could also close the program and open from your desktop in seconds
205	pos	I haven't had any mechanical issues
205	pos	All the buttons work well (no double clicking)
205	pos	I love the feature of the mouse wheel where if you push the button in below the wheel, it either opens fully or restricts slightly the motion of the wheel
205	pos	It's really cool
205	pos	I noticed that compared to any standard mouse I've ever used, my precision and accuracy of mouse movements has been greatly increased when using this mouse
205	pos	I haven't messed around with the weights, but you can add/remove weights to make the mouse heavier/lighter
205	pos	It's everything else about the mouse that I like
205	pos	Overall, It's a great mouse
206	neg	It's extremely frustrating to say the least
206	neg	Except the setting is from a much older version so can't do that either
206	neg	It's been 2 weeks and I already hate this thing
206	neg	Trying to do anything when your mouse flicks across the screen because you're trying to use it, is beyond annoying
207	pos	_-------_The moose was great while it worked, it pairs well with Logitech keyboards and the color is consistent because why not have LEDs everywhere
207	neg	But somewhere in the added complexity of including stuff like that reduces the shelf life
208	neg	Right mouse button started to fail after about a year
208	neg	I mostly use it for computer graphics work so it was incredibly frustrating when the mouse would basically unclick in the middle of a drag and drop or resizing of a window
208	neg	I was able to remap right click to another button, but for what I paid for it this is incredibly annoying
209	neg	First one was great till it had a double click issue, I assumed it was just me being unlucky and got a second one because it felt great
209	neg	And 1 year into it's life span it gets the double click issue again
209	neg	Updating drivers doesn't work
209	neg	Just poor quality in whatever they put into the clicker
209	neg	Clarification on the double click issue, pressing the right side for me will double click every time you press it
209	neg	Sometimes sticking so you cannot drag any windows anymore
210	neg	CONS:Mistakenly hitting the sniper button
210	pos	I would recommend this product
210	neg	UPDATE 4/30/19: Had it for a few months i think but now it's causing an issue
210	neg	Random double clicks when i try to hold down and drag something on my screen, noticed it when i was playing a game, caused my character to drop it on the ground instead of move it
210	neg	Seems this is a big issue going on with ANY G502 models
211	neg	First, the box was damaged a bit (As shown in picture) but that's okay, when I opened it up the mouse was dusty and dirty, it clearly had been used and refurbished (The box was sealed)
211	neg	There were smudges and scratches beneath the mouse
211	neg	The mouse looks sick and all, but it's actually not comfortable at all
211	neg	After using it for an hour, the feeling of discomfort is ON
211	neg	The scroll wheel is so stiff
211	neg	Overall I'm not happy with this mouse for its price, I have better choices for even cheaper prices
212	pos	The mouse feels great in the hand and all of the programable buttons are easy to reach
212	pos	It also has additional weights to get your desired amount of drag resistance
212	pos	The build quality seems pretty good
212	pos	The scroll wheel is solid, the cable is braided, and the buttons all have a good feel to them
212	pos	The Logitech software is very good for setting up macros, mapping buttons, changing RGB settings, etc
212	pos	Overall it seems like a great mouse for the price
213	pos	Plus, it's an excellent workout for your hand and arm movement
213	pos	And it's comfortable too when holding it
213	pos	The mouse response is good, plus the side buttons are an excellent feature
213	neg	Minor issues to keep in mind, it has a lot of open edges/corners that can collect dust and dead skin cells
213	pos	Steep price aside, I'd say it's a near-perfect mouse for your gaming and content creation needs
214	neg	I took a chance on this mouse and yep, the hardware broke in short order
214	neg	This mouse has just been on my desk with light use and already has issues
215	neg	It doesn't happen on every click, but as the mouse ages, it happens more and more until it is eventually unusable
216	neg	Unfortunately the Special Edition started having sustained click & drag problems, making it difficult drag & drop or highlight items after around a year of use
216	pos	Both of my standard G502s have worked perfectly for me
216	pos	The ergonomics are great, the button features are pleasant without being over riddled
218	pos	That will be well used in World of Warcraft and Grounded the Game
218	pos	This manufacturer has a very good rep especially with me
218	pos	Rubber with bumpy grips on left and right, helps hold the hand in place
218	pos	The cord is fabric lined so it doesn't have a "memory" of staying in a position it shouldn't
219	pos	This particular model has been one of my favorites and I use it on my main gaming desktop as well as my work laptop
219	pos	It has enough buttons to make it flexible without having so many as to make it overly complicated, especially for fingers that are not in the small glove category
220	pos	The mouse itself is great, from a hardware standpoint
220	pos	Fastest sensor, max of 25k dpi, reliable switches, what's not to like
220	pos	There are 2 buttons right next to the left mouse button, the most used button on a mouse, the 2 buttons adjust the dpi (sensitivity) of the mouse
220	neg	Because they are literally right next to the left mouse button, it is super easy to accidentally press on it
221	pos	First of all, this is a really comfortable mouse to use
221	neg	At that point - almost as if there was a timer in it, the left mouse button becomes intermittent
221	neg	You are at an extreme disadvantage when the trigger fails 50% of the time - until a few days later it is completely gone
221	pos	But it is so comfortable
222	neg	Holding the RMB down will intermittently register multiple clicks
223	pos	I absolutely love this mouse as a device
223	pos	The buttons are great, it feels good in the hand, it's very responsive
223	neg	What drives me insane is how awful the "GHub" software is
223	neg	It periodically updates and then randomly my mouse stops working until I spend 10-15 minutes fighting with the software to not default to a different profile or update firmware for a feature I don't need
224	pos	I love this mouse
224	pos	My girlfriend, who is a recent PC gamer convert, loves this mouse
224	pos	This mouse feels comfortable
224	pos	The customizable weights is a great idea
224	pos	The customizable buttons are also great, too
225	neg	Bought this a little over a year ago, started having issues with my left click button clicking multiple times with one click- very annoying and makes it impossible to use
225	neg	Basically, Logitech uses cheap & poorly designed switches that wear out easily
226	pos	Most of them have great response time, click well, and aren't mushy at all
226	pos	DPI can be adjusted on-the-fly or if you're like me, those buttons can be used for other purposes like macros, in-game actions, etc
226	pos	The good: 9 high-quality programmable buttons, and the scroll wheel
226	pos	The scroll wheel can be toggled from having a "bumpy" mode to free-spinning using a mechanical button (can't be programmed cause it functions mechanically)
226	pos	Weight can be changed
226	pos	DPI display (3 bars of light) allow easy checking of DPI
226	pos	Mouse can be tuned any way you want
226	neg	Scroll wheel tilt functions are a little more mushy, and it's hard to tell when they're activated
226	neg	The triangle patterns on both side of the mouse pick up dirt
226	pos	Pretty good mouse
227	neg	After a couple of months of use, this mouse wouldn't function properly, the pointer is jittery and won't hold among other things
227	neg	The 2nd mouse is doing the same malfunctions as the first
228	neg	You can have this problem with either the left or right buttons, or both
228	neg	But it got worse over time until it was clearly an issue with the mouse
228	neg	More often I get around 10 bad clicks out of 100
229	pos	I have slightly large hands, and even though this mouse has a slightly smaller footprint than the g602 it still fits my hand better
229	pos	I mean it REALLY feels great in my hand
229	pos	Well worth the $80
229	pos	I also love the logitech gaming software and the ability to adjust your DPI profile settings and such
231	pos	This mouse feels great
231	neg	The two buttons on the left side are a little too low
231	neg	My biggest complaint is the scroll wheel is free flowing
231	neg	It spins too easily and there's no click sensation
232	neg	It requires different software (G Hub) which also requires uninstalling LGS
233	neg	And this mouse failed me 5 days ago
233	neg	it will drop the signal suddenly
233	neg	Failed within half year is a totally new experience for me
233	pos	Beside this problem, it is a comfortable mouse
233	neg	However, it failed to deliver the basic mouse function
234	neg	The left click on this startes getting flaky about 6months after purchase
234	neg	It would randomly drop the click, so click-and-holds were frustrating
234	neg	A full force press causes the drop, while a minimal force seems to work fine
236	pos	Pros:- Easy to map new bindings to each button with the software available
236	pos	- Good solid feel to the mouse overall and about the same size as the razer 2013 deathadder (meaning it's decent for larger hands)
236	pos	- There are included weoghts allowing for adjustment based on personal preference
236	pos	I find certain mice to be too light, so the option for additional weight is personally greatly appreciated
236	neg	Cons:- You are required to download the software for this mouse manually and it isn't the easiest interface I have ever used
236	neg	Without previous software experience (mine being from razer synapse), it might be a challenge for inexperienced users
236	pos	All in all:This mouse is a great choice for the most seasoned veterans of gaming and the new-comers alike
237	pos	This mouse is faster and more responsive than my previous one, which was the Gamdias Ourea mouse
237	neg	Sometimes the mouse would stop being recognized in my windows 10 pro 64bit 20H2 system
237	pos	Software and drivers work perfectly and the support is excellent
237	pos	Highly recommend this mouse for all your gaming needs
238	pos	The software is intiutive and doesn't feel bloated
238	pos	Has everything you need to control RGB, DPI and other settings
238	pos	I love the option of customizeable weights
238	pos	Highly recommend for this price range
239	pos	This is a great mouse
239	pos	Very responsive and comfortable
239	neg	But expect to have to buy a new one every year because the switches for the left and right click wear out and start double clicking shortly after a year of normal use
239	neg	Issue is, you can only click a certain number of times before it's deemed defective or not
239	neg	Mine was having an issue, but not reliably enough to be caught by their check so I wasn't able to exchange the mouse
240	neg	I am extremely disappointed with this mouse
240	neg	Earlier this month, I started to notice that the right mouse button wasn't detecting when I clicked
240	neg	Now even that doesn't work
240	neg	The only thing that seems to reliably get it to detect the click is pressing down VERY hard whenever I right click
240	neg	In addition, starting yesterday I ran into the same issue others have described where it double-right clicks with only a single click of the button
240	neg	It's getting to the point where a number of games are becoming almost unplayable, so I have to replace the thing
240	neg	Words cannot begin to express my disappointment
240	neg	It is possible that what I've experienced is a freak incident
240	neg	I do not intend to buy this mouse ever again
241	pos	No double clicking, very "hefty" feeling (not heavy as in "I can't move the mouse quickly", but heavy as in "that feels sturdy and of good quality"), feels great to hold in my hand
241	pos	You can also add or remove weights from the mouse to control how light you want it to be, which I think is really cool
241	pos	I haven't programmed many of the buttons yet (I guess I'm lazy), but it does have the option for those shortcuts to be customized
241	pos	If you're hesitant, I would definitely recommend this mouse
242	neg	He is on his second mouse and told me that it is the worst mouse to buy since left click has a defect
242	neg	I am on my third mouse and confirmed with him that my third mouse has a defect on left click as well
242	neg	DO NOT BUY THIS MOUSE TO PLAY VIDEO GAMES OR ANY PC EDITING
242	neg	This mouse will double click with a single click or when clicking and holding/dragging items it will not register or let the item go
243	pos	First off, this is a great mouse when it works properly
243	neg	Unfortunately when I lift off the pad to reposition during gaming it sometimes loses tracking for a moment and launches my view all over the place until it reestablishes tracking
243	neg	I've searched for solutions and it seems to be an somewhat common issue with the Hero sensor
243	pos	As for ergonomics, I would love to meet the person who decided to put the 2 dpi selector switches right next to the left click button
243	neg	I wouldn't buy it, the new hero sensors dont live up to the hype and were going backwards in ergonomics
244	neg	The right click on this mouse stopped functioning properly within 8 months
244	neg	After two weeks of back and forth, providing a video of the problem, providing a picture with my ticket and serial, I get a message saying it's out of stock and to wait another 3 weeks
245	pos	This one is even better with the ability to change the color and the new cable
245	pos	My favorite is between this and the original r
245	pos	With the thinner, lighter cable on the hero and the ability to change the lighting, it's near perfect for me
246	neg	However, I am frustrated that after a little over a year, this mouse developed the same left click issues my last one (Logitech Wired Pro which also lasted a little over a year) did
246	neg	Whenever I perform a single left click, it often clicks twice and when I hold the left mouse button to drag (like you do all the time in a strategy game or moving files around) it will regularly disengage as if I lifted my finger, even though I am not changing pressure
246	neg	Nearly every time I single clicked a space in this text box, while writing this review, I selected the word next to the space like I double clicked or the entire paragraph like I triple clicked
247	neg	It has an infamous problem where it gets stuck in an infinite loading screen after a fresh install or update
248	pos	The mouse is heavy and feels very premium
