56	pos	Good weight, good cable, scrolling and buttons all feel good
56	neg	"The one huge giant issue I've already run into in my first week of owning it is the new version of the horrible ""G HUB"" software"
56	neg	It constantly ignores my profile and button assignments
56	neg	I have the mouse set to use 400 dpi with all profile switching and DPI switching buttons disabled
56	neg	At least once a day I need to un plug and re plug in my mouse as it seems to go to the default 1200 dpi, and ignores all my configured buttons
57	neg	"The mechanical aspects of the wheel also are very poor, as the ""free wheel"" and the ""resistance mode"" of the mouse feel pretty much the same, resistance mode I can almost free spin the mouse to the same extent of free wheel"
57	neg	Added to the fact that it just feels clunky, loose, and wobbles around making a rattling sound when Im using it
57	neg	I was feeling more like the mouse wheel was made for some $3 trash mouse you would buy in a swap meet and they just threw it in there
57	neg	I dont know exactly what it was about the design, but from the first moment I used it, it just felt wrong in my hand
58	neg	This model suffers from a design or manufacturing flaw
58	neg	So you point and click, but the mouse moves the cursor a little, so you miss your target
58	pos	The weights are friction fit, so they stay in place
58	neg	I marked it down one star for the software and button arrangement, and down two more stars for the bottom plate defect
59	neg	Hype and marketing aside, this mouse has serious flaws, immediate quality control ones as well as general design ones
59	neg	The BAD:This mouse doesn’t glide side-to-side or up-and-down as much as it scratches and grinds all over the place
59	neg	Another issue is plastic
59	neg	Cheap plastic everywhere that is
59	neg	Smaller, more plasticky with horrible QC and design decisions
59	pos	)The GOOD:The sensor is top notch
59	pos	Cord is pretty nice
59	pos	Extremely flexible and seems to be of high quality
59	pos	Logitech software is still intuitive, relatively low resource, and available in most common language including English
59	neg	Summary:Downcosted all around, overly plasticky, poor quality control, worse than poor design choices, lack of rubberized coating where needed, shrunken, shrunken, tiny, TINY, mouse
60	neg	But, for me anyway, for my uses it has a major flaw: It's kind of small, so anyone who uses a Palm Mouse Grip will find it uncomfortable
60	neg	That factor comes into play during long/er gaming sessions, because to a large degree it majorly reduces hand fatigue & maximizes comfort
61	neg	I am used to the design, but this one is so bad and vague that I had to straight up disable the rocker, so now I only get about 15% of my middle clicks mis-sensed
61	neg	"You have to press it with the knuckle of your thumb, which requires an incredibly awkward ""palm pinch"""
61	neg	If you use all the mouse buttons in a game, you're going to hate this thing so much
61	neg	The second one's L2 switch itself is now failing, as it registers right click but doesn't register HOLDING it
61	neg	After only a year, this is appalling
61	neg	If you play MMO's, this makes steering an absolute nightmare
61	neg	If you play FPS games, right click iron sight/scope becomes agony
61	neg	This one is getting hucked in the garbage because it fell to pieces in a little over a year and a half
62	neg	Such a disappointment
63	pos	This mouse is precision
63	pos	Everything works precisely and is accurate
63	pos	Nice to be able to change dpi on the fly
63	pos	Where it shines:  Precision and smooothe sliders make it a snag free accurate mouse, clicky scroll wheelmouse cable never noticed while in use
63	neg	ANY other grip is PAINFUL
63	neg	I'm NOT SAYING it doesn't work WELL, just that it has extremely limited grip styles
63	pos	I personally prefer for the mouse to support my other fingers
63	pos	I am paying the mouse after all
65	neg	I can't copy and paste text with this mouse at all
65	neg	Tried multiple computers - same result
65	neg	G502 is defective and you can see a lot of videos and read reports of these problems
65	neg	It feels good in the hand, but impossible to use
65	neg	Forget about gaming of any sort since it will not do what you tell it to do
66	neg	The recent versions show a lack of quality in workman ship
66	neg	Issues I've encountered:  1) double-click on single for both left and right, rarely at the same time
66	neg	2) Mouse wheel gets stuck in a push (I barely use the mouse wheel as is, but seen it get stuck in the shift function)
66	neg	3) Mouse wheel keeps spinning after touch (basically, the weight is off and keeps spinning until it corrects where it thinks it wants to be, not where user places wheel)
66	neg	4) software updates requires a system reboot and locks all functionality until restarted
66	neg	Mouse rated for 50M clicks (per Logitech's website), no way I've hit that in 4 months
67	pos	I need different shortcuts on different software and so the G502 works perfectly and the user interface (which has been updated, but I haven’t replaced there) is easy to use
67	neg	Let’s start with the software: I installed it easily enough but it wouldn’t recognize the mouse
67	neg	Except scrolling was inverted and it would go up when I tried scrolling down and viceversa
67	neg	More wasted time, more restarts and more reinstalls and setups later and best I would get was a couple hours of work before shortcuts crapped out again
68	pos	Instead I received a great quality mouse that felt better in my hand and even shocked me with its great remapping software
68	pos	The integrated games mapping is awesome
68	pos	Before I had to go into a game and find the mapping to make a profile on my mouse and remap that to whatever button I wanted
68	pos	With the Logitech software it scans the games and tells you exactly what mappings do what
68	pos	It's kind of hard to explain but it makes things so much easier
69	neg	probably because it's a terrible shape
70	neg	My main issue with the mouse itself is that I find myself accidentally clicking the left mouse button pretty often with the G502, so I think buttons are quite a bit lighter/easier to press on this mouse
70	neg	The thing that I really dislike the most about this mouse is  G Hub, the software Logitech pretty much forces you to use if you want to get the most out of the mouse
70	neg	Overall, I'm pretty displeased with this mouse
71	pos	This is an absolutely fantastic right handed mouse
71	pos	I literally can't find anything else that feels as good as this does on my hand and wrist
71	neg	My mouse's left click started double clicking on every click about two months into ownership
72	neg	This mouse even with the weights added feels very light, much lighter than the G700s
72	neg	It also feels incredibly cheap, especially the scroll wheel which feels very flimsy
72	neg	The scroll wheel is also annoyingly loud when not in frictionless mode
72	neg	It does not have a smooth clicking sound like the G700s, but sounds like its grinding
72	neg	Frictionless mode is really loose scrolling up and down pages, far more than a G700s
72	neg	Ergonomically its smaller than a G700s, sitting much lower and does not feel like any the older G-series mice, forcing me to uncomfortably extend my wrist
73	pos	Loved the mouse
73	neg	Shame on you Logitech for being ridiculous in your cordless pricing
73	neg	The mouse wheel buttons are defective
73	neg	If you press down on the middle mouse button it presses the left and right side wheel buttons as well (randomly)
73	neg	The left and right wheel buttons are ridiculously sensitive to the slightest touch
73	neg	They even get pressed when I'm just using the wheel and not meaning to press a button
73	neg	You literally can't click the middle mouse button without clicking a left or right side wheel click simultaneously
73	neg	I bind all 11 mouse buttons for games and nearly every time I click the middle mouse, it clicks button 10 or 11 as well
74	pos	It even worked when mostly broken
74	pos	When it’s not broken it works fantastic as well
74	pos	Accurate, super customizable, wonderfully ergonomic if you have giant weight lifting meat claws like me
75	neg	This new mouse (logitech hero), developed the same issue in less then a couple months
76	neg	The software is not intuitive, and seems to have a mind of its own
76	pos	Logitech makes great stuff, I have many other items
76	pos	This mouse is built well, solid and feels good
76	pos	Just way too much overkill
77	neg	When this mouse began showing the same symptoms, I was disheartened to say the least, especially so since the mouse was out of the return window, but less than a year old
77	neg	The cause of the double-click bug is due to a technical oversight in the switches longevity when in a newer, more power-conservative circuit, I was told
77	neg	If you can replace the switches, either by yourself or with some help, I can recommend this mouse, otherwise, expect to replace it within two years, most likely
77	neg	I can think of at least ten different ways to prevent this pin from sliding
77	neg	I've had good experiences with their products every single time I've bought them until now, and its very unfortunate that this is the first thing I've bought from them that has disappointed me
77	neg	I cannot recommend this mouse
78	pos	It has performed quite well, and with my large hands, the fit is pretty good
78	neg	The only issue I have had, as have others, is the middle wheel/button
78	neg	It is very easy to mis-click with it, and hit one of the side buttons when trying to click the center
78	neg	I highly recommend not using the center or wheel side buttons for anything essential in the game, as in the heat of a big battle, the odds of you hitting the wrong ability are pretty high
78	pos	The scroll function is good, and it's nice to be able to turn off the wheel clicker for free scrolling when I want
78	pos	With adjustment capability and a better middle button/scroll, this would be a 6 star mouse
78	pos	I don't regret buying and using this mouse
79	neg	Turns out it did not last even 4 months before the left click started to double click and lose the sensor that is is being held down
79	neg	I click and drag a lot for work, and this is unacceptable that the mouse did not even make it a year
79	neg	Very disappointed in Logitech product quality for this price range
80	pos	There is a ton to like about this mouse from how it fits into your hand, the grip, and the competitive edge for gaming you will begin to notice immediately
80	pos	So, it is important for me that I have a mouse that I can use which is comfortable, useful, and fits my basic needs
80	pos	- Fits incredibly well around your hand 
80	pos	- Many different buttons that can be programmed for different use  > Shortcut keys, Forward/back from a page, etc
80	pos	- Great grip 
80	pos	Following pros: - You can change the DPI for each account, and each profile can have an option for many DPI's
80	pos	The DPI is especially useful for getting the accuracy you need in a mouse
80	pos	- The buttons are programmable
80	pos	This means that for every game you play you can set up the mouse buttons to however you want
80	pos	I personally like having important buttons be G8 and G9, then secondary buttons are the default forward/back
80	pos	With gaming, how quickly your respond to something will play a huge effect on your success as a gamer
80	pos	Simply being a bit faster means a huge difference between success and failure
80	pos	Overall, I am extremely happy with the quality of this mouse and will update in a few months after I have had some more time to break it in
81	pos	This mouse is awesome for gaming and office work
81	pos	I have bigger hands and my hand fits comfortably
81	pos	I do a ton of gaming with a side of office work with daily use and this mouse holds up for whatever task is thrown at it
81	pos	The RGB is a nice touch
81	pos	I like that when you change your DPI you can quickly glance at the RGB lights to determine which one you're using
81	neg	I have 2 complaints and that is that the 2 buttons to the side of the left-click button are easy to click on accident
81	neg	It doesn't happen to me a lot, but it definitely does happen usually when I go to place my hand back on the mouse
81	neg	My second complaint is that the rubber grips get dirty and it is kind of hard to clean in my opinion because of the texture it has
81	pos	Great mouse overall
82	neg	Love this except for one flaw that is kinda bothering me
82	neg	I’ve rearranged the weights several times to try to fix, to no avail
82	neg	So this makes me wonder now if I DO in fact have a defective product
82	pos	The mouse fits comfortably to my hand, feels great, and has great response times
82	pos	Same design and after using it for a week, I’m completely in love
83	neg	For some games, this may not even noticeable, but for others it can render the game unplayable
83	neg	From what I've read online (could be completely wrong, I'm not an expert) the switches logitech uses are relatively cheap Chinese-made switches not ideal for operating at the low voltages this mouse outputs
84	pos	I have larger hands and this mouse is a little longer than others I've tried so it fits me really well
84	pos	I love the freewheel scroll feature
84	pos	I don't think I will be able to go back to a mouse without that after using this thing
84	pos	This mouse has just about everything I could ask for
84	pos	Different profiles, on the fly sensitivity changes, plenty of buttons, customizable RGB
84	pos	Its a fairly heavy mouse even without the weights
84	pos	I have left the weights out completely of both of my mice
84	pos	I would say it is fairly durable
85	neg	Ergonomically, it feels bulky and a bit awkward
85	neg	It still periodically freezes and requires a re-install to get it working again
85	pos	If the software's going to be integral it should be light, precise and stable
85	pos	It is none of those things
85	neg	More errors
85	neg	Downgraded to 1 star because I am no longer using the mouse due to software issues
86	neg	You can't turn the RGB off but you can set it to one colour and not have it flashing
87	pos	I bought this mouse to replace a very disappointing Corsair mouse of similar design that finally wore out
87	neg	The one drawback I've found is the scroll wheel
87	neg	However, when in freewheel, the wheel has a terrible tendency to have backlash, most likely due to the sensor design
87	neg	I found the left-right scroll doesn't work with all programs either (Excel being one), which was also a disappointment
88	neg	After only a single year, the primary button, m1, suffers from severe stuttering and unreliable response from user inputs
88	neg	It is utterly ridiculous for a mouse at this price point to suffer from a hardware flaw like this so soon, and apparently it is a common issue with many other logitech brand mice
89	neg	This mouse is a major disappointment
89	neg	The biggest problem is a defective left-click button
90	neg	Just holding this mouse makes my wrist cramp, it forces a claw-grip with your pinky and ring finger to hold the mouse and is extremely uncomfortable when you have to grip it hard
90	neg	The Software (G Hub) is required, and has to be RUNNING IN THE BACKGROUND at all times in order for 90% of the mouse's features to work
90	neg	The mouse claims to have on-board memory but NONE of the settings can be customized with it, you can only use pre-made profiles which all suck
91	neg	The issue was that the left click was no longer working as intended
91	neg	I was not able to click and drag anything and would occasionally register a double click
92	pos	This will give you the most precise tracking you can get from the mouse
92	pos	I love heavier mice and this one has weights
92	pos	Surely a Plus as well for me
93	pos	this has the potential to be SUCH a great mouse
93	neg	but *EVERY* time it does an update to its software (which is at least once a week) it WIPES OUT all your settings
93	neg	so you have to go back through and ONE BY ONE put each setting back on each button
93	neg	it COMPLETELY ignores your settings to not update
94	pos	The adjustable weights are also a plus
94	pos	The extra buttons are also a big plus
94	pos	It has a couple and they can be very useful
94	neg	The only downside I can think of is the mouse itself is rather a bit small for my taste and I think it could use a pinky support but I do have large hands so perhaps it isn’t applicable for everyone
94	neg	Also while it does have many extra buttons, the thumb one is awkwardly positioned right under the thumb so I frequently press it by mistake
94	neg	The two index finger buttons next to left click are also a bit inconvenient because one would have to move the index finger off the important left click to use them
95	pos	It feels very solid and slides effortlessly
96	neg	Well, just the initial impression so far is not that great
96	neg	The front pad was completely off, and the side and back surfaces were barely attached
96	neg	The reach for the forward thumb button is pretty far
96	neg	That button is way to far forward
96	neg	This thing feels really cheap
96	neg	The buttons are super flimsy
96	neg	If you don't see a progress bar after you start the update, you pretty much need to unplug the mouse and plug it back in
96	pos	The best part is, there is a place to set the DPI lights to be on all the time
96	neg	Glossy and smooth buttons are not great, and I keep accidentally dropping my DPI with that button location, and the fact it is so easily pushed
96	neg	Long story short, with the software flaws, the loose gliding material, and the smooth buttons, I'm leaving it at a 3 stars
96	pos	Still braided, but way more flexible
97	pos	First is the design:The design, while unusual, works fairly well
97	pos	I have small hands, but I'm able to reach AND use almost all the buttons
97	pos	Due to the placement, I do have issues reaching the G7 button without adjusting my hand to press it
97	neg	The middle mouse button (MMB) is somewhat hard to press for me, mainly due to the required pressure needed
97	pos	As for the DPI Shift button, it's a little bit forward-placed for someone with small hands, but still easily reachable
97	pos	All of the buttons can be reassigned via G-Hub, and drag-and-drop is the easiest way to do it
97	pos	If you're interested in the G502 Hero, I would suggest that you give it a try, as it seems to be a fantastic mouse for me so far
98	pos	This is a fantastic mouse
98	pos	The buttons and even the scroll wheel are PERFECTLY clicky
98	pos	If you don't like that, the scroll wheel "click" can be turned off with the button directly under it, so it free spins
98	pos	and can built your own, along with setting up the "G" logo color palette
98	pos	The sides are rubberized, which provides excellent control for button use
98	pos	The bottom is slighlt gridded for friction & the wire is covered in woven nylon & runs about 6 ft
98	pos	I couldn't be happier with this mouse
99	pos	Way better/more customization option, buttons clicks really good and overall build quality is awesome despite the cost of this mouse just being 40$
99	pos	Little plastic container contains multiple weights to weigh down your mouse is a surprise for me
99	pos	Those thing fits under discretely
99	pos	Placement sucks
99	pos	Other than that issue, overall mouse is really good
99	pos	Like, actually good
100	pos	The resolution as expected
100	neg	Update few months later: docked two stars, left button has developed switch bounce and now sometimes clicks multiple times with one press of the button
100	neg	Button got worse (couldn't even drag anything; real fun playing the "which folder did the file get dropped into
101	pos	Between being able to customize the other buttons on your mouse, on top of your DPI, but it also has an unlockable mouse wheel
101	pos	Scrolling through a big inventory, or a long thread online
101	pos	The wheel itself is comfortable, and really sturdy when you're clicking, or even scrolling
101	pos	The other buttons don't get in the way of your clicks, and the wheel lock is completely out of the way when you're using it
101	neg	The only (probably personal) issue I have so far is, my mouse does glitch out, and moves either in one direction, or spasms
101	pos	The firmware is great (not needed), the mouse is comfortable, and if you're a fan of weighted mice like I am, it has a sizeable, adjustable weight you can fit inside
102	pos	It fits nicely in the hand, has adjustable weights, and the perfect number of buttons for most gaming styles
103	neg	Both are having typical left click failures, so I wanted something heavy with a larger footprint like the M65
103	pos	The magnetic flap is one of my favorite design choices as well - it's dead simple and honestly really cool
103	pos	The scroll wheel is solid and tactile, and provides a rewarding click when using
103	pos	With the scroll button disengaged, the scroll wheel is buttery smoooooth
103	pos	I've always avoided Logitech products because of their "office" products, but this mouse has definitely exceeded my expectations so far
104	neg	I am having tracking issues with mine
104	neg	But when using it, you can feel it hang on something and stop moving for a sec
104	neg	But this mouse not working for me
105	neg	Two issues immediately stood out
105	neg	The G502 scrollwheel has a slick metal surface that's almost slippery, and a LOUD clicking in step-mode
105	pos	The button for switching to smooth scrolling is a nice feature, but in step mode it's just too clunky
106	pos	The upside: The mouse feels nice and glides effortlessly across most surfaces
106	pos	It is comfortable
106	neg	Glider Wheel broke several months in
106	neg	Again, the right click stopped working
106	neg	It still clicks, I can feel it, I can hear it, but the mouse doesn't react
106	neg	I disassembled, cleaned, reassembled and still nothing
106	neg	Unreliable DPI stability feature
106	neg	The entire software setup, this gHub or whatever, is absolute garbage
106	neg	There are too many other things I want to say about this product, but overall, and being a lifelong fan of Logitech, I'm more than disappointed
107	neg	G-Hub did not work on Win 7 for me, and there's no Linux support
108	pos	It was comfortable to use so I never put much thought into it
108	pos	And holy cow is this an awesome mouse
108	pos	The customization features in the Logitech Software alone is super easy to use and make adjustments for later
108	pos	Console gamers looking to dive into PC, give this mouse a shot, it has enough customization options to fit just about anyone’s needs
110	pos	This is an extremely precise and reliable mouse, both with movement and scroll wheel
110	neg	The only annoying thing about it is the non-adjustable "thunk" of the scroll wheel, it's too "notchy"
110	neg	- if you engage it, the scroll wheel has a super annoying "thunk" every time you turn the mouse wheel
111	pos	Buttons: It has enough buttons to assign several functions to them in games without going overboard
111	pos	Weight: Medium to heavy depending on weights added
111	pos	There is a hinged magnetic "door" on the bottom of the mouse that makes it extremely easy to adjust the weight of the mouse on a whim
111	neg	Cons: The only minor con is that the scroll wheel very slightly jiggles when flicking the mouse quickly
111	pos	The jiggle was nearly eliminated and the friction free scrolling still works fine
112	neg	Sadly, after using it for an afternoon, I found to be a poor choice for me
112	pos	Pros:-The smoothness of the sensing is excellent
112	pos	I felt my ability to pick precise targets in shooting scenarios would be enhanced compared to my old Microsoft mouse
112	pos	-The ability to switch the scroll button to free-wheeling is handy and satisfying
112	pos	-Materials do seem to be nice and solid
112	pos	-The weights are a nice touch for customizability
112	pos	-The lights add visual appeal without being too flashy
112	pos	Colors are customizeable
112	pos	-The quantity of buttons available is good, and their locations are easily accessible by fingers without accidental touches just from gripping the mouse itself
112	pos	-The sliding surfaces on the bottom are smooth and large
112	pos	Ergonomics were good compared to a more standard shape
112	pos	-The multiple profiles available for single or multiple customized DPI & programmed button settings is nice
112	neg	Cons:-There's too much resistance on the scroll wheel when free-wheeling is disengaged
112	neg	When my fingers were dry, they would actually slip on the metal wheel surface instead of rolling it
112	neg	I found it very difficult to consistently press only the center scroll button
112	neg	Most of the time I was accidentally pressing down and left or right at the same time
112	neg	I found this highly annoying, and it made it harder for me to hit targets
113	neg	The left click works when it wants too
114	neg	It would randomly drag itself across the screen and freeze and I’d have to unplug and re-plug-in the mouse to my computer in order for it to start up again
114	neg	Super annoying after the first two or three times and it began doing it more often as time went on
114	neg	This one is not worth buying
115	neg	NEGATIVES:What is NOT my fault is the overly sensitive Click Pressure on all the face and side buttons
115	neg	MORE NEGATIVES:The Mouse Wheel has to be some cruel experiment in psychological warfare
115	neg	The Lock/Unlock implementation warrants detailed comment in both states
115	neg	* As a free spinning wheel, it fails due to floatiness
115	neg	You get this awful effect where physically, the wheel will "back rock" or fore rock" to cradle itself between the teeth
115	neg	Further exacerbating the issue is you cannot change the internal DPI of the mouse wheel sensor
115	neg	I want to rip the wheel out of the mouse with my teeth and grind it until my gums bleed
