83	neg	Really annoying and unfortunately the problem developed just a few days outside the 1 year warranty window, so I replaced it with a Razer Viper Ultimate and I'm much happier with it than the G502
84	pos	I bought the original (non-Hero) G502 about 5 years ago and loved it
84	pos	I bought this mouse as a backup and just opened it up about a month ago when the scroll wheel of my original got a piece of dust stuck in it and would center click as I scrolled
84	pos	I've since got the piece out and it works fine again though
84	pos	I have larger hands and this mouse is a little longer than others I've tried so it fits me really well
84	pos	I love the freewheel scroll feature
84	pos	I don't think I will be able to go back to a mouse without that after using this thing
84	pos	This mouse has just about everything I could ask for
84	pos	Different profiles, on the fly sensitivity changes, plenty of buttons, customizable RGB
84	pos	Its a fairly heavy mouse even without the weights
84	pos	I have left the weights out completely of both of my mice
84	pos	I would say it is fairly durable
84	pos	I have 2 younger children and my original G502 has held up to years of their abuse and I'm sure the new one will as well
84	pos	At $37, I will probably be buying a 3rd one just to keep as a backup
85	neg	If I had to buy it over again based on the mouse alone I wouldn't
85	neg	Ergonomically, it feels bulky and a bit awkward
85	neg	Since that's a bit subjective, I'd say it might be worth a look at if your hands are on the larger side, however the software from day 1 has been buggy, and not worked properly
85	neg	Ive tinkered with it for a few weeks now and still cant get it to to start with the computer
85	neg	It still periodically freezes and requires a re-install to get it working again
85	neg	Google "LG hub error" and make your decision based off those results
85	neg	If the software's going to be integral it should be light, precise and stable
85	neg	It is none of those things
85	neg	3/19/21 update: Now Logitech Ghub sporadically switches profiles
85	neg	More errors
85	neg	Google results show many with the same issue
85	neg	Running this on a 2020 RTX laptop, so hardware compatibility should not be an issue
85	neg	Downgraded to 1 star because I am no longer using the mouse due to software issues
85	neg	7/13/21 update: More Ghub issues- freezes and there is an article on how to fix the problem online (so it's a known issue) but it is a tedious process to re-install the proper way (doing a simple add/remove wont work and the error persists) At this point, assuming GHUB is part of all logitech mice, I would avoid Logitech mice all together
86	pos	I got this because I thought it had some heft to it, but even with all the weights added to it it's still a bit light, but it is better than the ultra light 3 button mouse I was using
86	pos	I have large hands and it is just a touch small for me
86	pos	The scroll wheel seems to be a bit too sensitive, although that might be due to some software glitch that the last Windows update caused
86	pos	You can't turn the RGB off but you can set it to one colour and not have it flashing
86	pos	Also the DPI buttons are on the side where my thumb rests, I have no reason to change them on the fly, and would rather have the usual extra 2 buttons there instead of on the top left of the mouse
87	pos	I bought this mouse to replace a very disappointing Corsair mouse of similar design that finally wore out
87	pos	I can say that this mouse stands up next to the Corsair counterparts reasonably well albeit with a bit less "flair"
87	pos	I found the feel and movement to be comparable and the DPI setting ranges are equal if not a bit better in this case
87	pos	There are plenty of buttons and the customizable weight was a feature that I first thought was largely useless, but actually gave me a chance to improve the feel and movement from the "stock" configuration
87	pos	The one drawback I've found is the scroll wheel
87	pos	You have two options: rock hard or complete freewheel
87	pos	After using it for a few weeks I determined that the "rock hard" setting became tiresome when scrolling through webpages and that the freewheel setting enabled quick scrolling
87	pos	However, when in freewheel, the wheel has a terrible tendency to have backlash, most likely due to the sensor design
87	pos	I haven't encountered any broken switches or movements, but suspect several of the reports of "broken wheels" may be due either to the user not realizing the mode is toggled by the (undocumented) toggle "button" just below the wheel or using the "button" as a brake in freewheel mode, which I found will likely cause the ratcheting mechanism to bind and break
87	pos	Another somewhat disappointing feature of the wheel is that the left and right scroll wheel movements are single clicks rather than repeating, which requires repeated clicking left or right to scroll instead of having a continuous movement like older Logitech mice did
87	pos	I found the left-right scroll doesn't work with all programs either (Excel being one), which was also a disappointment
87	pos	Another recent discovery is that, like the Corsair I had previously, recent updates to their software can cause severe system crashes, which has led me to disable updating altogether
87	pos	Attempts to alert the company to this issue met with a canned response, leading me to believe they're not too concerned about the quality of their driver software, which is unfortunate
87	pos	This would be a five-star mouse if the scroll wheel was improved and if we didn't have to worry about a driver software update completely breaking our systems without warning
88	neg	The media could not be loaded
88	neg	For the first year this mouse was truly fantastic, would have whole-heartedly given it 5 stars, however after only a single year I have encountered a problem that renders the mouse nigh unusable
88	neg	After only a single year, the primary button, m1, suffers from severe stuttering and unreliable response from user inputs
88	neg	It is utterly ridiculous for a mouse at this price point to suffer from a hardware flaw like this so soon, and apparently it is a common issue with many other logitech brand mice
88	neg	Trying to navigate through the Logitech warranty website is a purposefully roundabout experience in order to do anything except give you a replacement under their own warranty policy
88	neg	This is  made increasingly more aggravating by attempting to fight your way through their site with a busted mouse
88	neg	Needless to say I am very disappointed in my purchase and will be avoiding Logitech for any future hardware needs
89	neg	This mouse is a major disappointment----1--The biggest problem is a defective left-click button ---- The button operates randomly and can take anywhere from 1 to 4 clicks to open a program
89	neg	When I went online to see if the defect was solvable, there were 100s of “Logitech Mouse Button Click Problems” hits
89	neg	Given the button defect, the mouse is being returned
89	neg	2--The new Logitech 9
89	neg	02 gaming software is a pain in the neck and worked so poorly that I uninstalled it and reverted to a prior version of the software that is far more user-friendly
89	neg	3--The mouse wheel has a slippery graphite feel, which is somewhat surprising for a mouse built for exact mouse movement
89	neg	4--The “user documentation” that came with the mouse was limited to a few small stick figures with text so small that I had to pull out a magnifying glass to read it
89	neg	The mouse did come with a large G decal and a fancy, but useless, color promo flyer----  I suspect that most users would prefer that you dump the flyer and decal and devote more focus to a decent instruction sheet
90	neg	Just holding this mouse makes my wrist cramp, it forces a claw-grip with your pinky and ring finger to hold the mouse and is extremely uncomfortable when you have to grip it hard
90	neg	The Software (G Hub) is required, and has to be RUNNING IN THE BACKGROUND at all times in order for 90% of the mouse's features to work
90	neg	The mouse claims to have on-board memory but NONE of the settings can be customized with it, you can only use pre-made profiles which all suck
90	neg	So if you want to change DPI, Polling Rate, or any of the button functions, you need G Hub running at all times
90	neg	For folks like me who like to squeeze as much performance from their machines as possible, this is unacceptable
90	neg	In my task manager right now there are 6 different G Hub
90	neg	exes using up a total of 246 CPU threads, and an absurd 300mb of RAM
90	neg	If the mouse had working on-board memory this wouldn't even be worth mentioning, but it doesn't, so it is
90	neg	Coming from a G700 (another Logitech mouse) I thought this mouse would be an upgrade, little did I know that my 7 year old mouse was leaps and bounds ahead of this modern brick
90	neg	My G700 also needed Logitech software to customize, but it had WORKING ON-BOARD MEMORY, meaning if I wanted to set the DPI and save it to the mouse for use on another PC I could easily do so, with the new G Hub software this is impossible
91	pos	07/19/2021I've bought this product twice, once back in November of 2019, a second time a week ago
91	pos	The issue was that the left click was no longer working as intended
91	pos	I was not able to click and drag anything and would occasionally register a double click
91	pos	Apparently this is a common issue, but at the price, I just couldn't find another mouse that could compete
91	pos	At the price, it's reasonable, I just wish if it was such a common issue, for it to have been fixed already especially since it's one of their more popular gaming mouse
91	pos	Since then, I've also purchased a MX Master 3 and use them side by side depending on my uses
91	pos	It's still one of the better gaming mouse out there, especially for the price
92	pos	To fully take advantage of this mouse's precision, go to the mouse settings on Windows, set it to the slowest setting, then go into the Logitech software and up the DPI
92	pos	This will give you the most precise tracking you can get from the mouse
92	pos	A lost of people seem to just use a lower DPI in the mouse software and wonder why with small movements, the mouse becomes jumpy
92	pos	Don't be that person
92	pos	Set up your software correctly
92	pos	And why do you want to do it this way
92	pos	Well, because the mouse has buttons with which you can slow it down or speed it back up anytime - it works in normal windows mode and in games on a hardware level and there is no adjustment needed after you set it up initially
92	pos	The other way round, you would have to go into game and/or Windows settings to make those changes
92	pos	PS: I also have the G900 and G903 with PowerPlay
92	pos	I use the G502 HERO for my work machine I mainly use for office work and I used a cheaper mouse before that was just so annoying when trying to pull on Excel cell corners - you need the precision at that place
92	pos	However, I didn't want to break the bank after spending over $200 for a wireless low latency setup on my gaming PC
92	pos	This mouse has all that for less than $50 with the only limitation that it is wired
92	pos	I love heavier mice and this one has weights
92	pos	Surely a Plus as well for me
93	neg	if you want a great gaming mouse that remembers your settings, this is NOT what you're looking for
93	neg	look
93	neg	all the other positive reviews about the features, buttons, button sets, etc
93	neg	are true
93	neg	this has the potential to be SUCH a great mouse
93	neg	but *EVERY* time it does an update to its software (which is at least once a week) it WIPES OUT all your settings
93	neg	so you have to go back through and ONE BY ONE put each setting back on each button
93	neg	sometimes 3 times a week
93	neg	logitech has confirmed this is the EXPECTED behavior
93	neg	the "work around"
93	neg	they expect YOu to export your settings to the cloud, and then reimport EVERY time it updates
93	neg	so i turned off auto updates
93	neg	guess what
93	neg	IT AUTO UPDATES ANYWAY
93	neg	it COMPLETELY ignores your settings to not update
93	neg	this behavior exists on both mac and pc
93	neg	THIS
93	neg	THING
93	neg	IS
93	neg	GARBAGE
94	pos	I’ve read a lot of reviews where people complain about a double clicking issue or uncomfortable button locations and stuff so I thought I’d share my thoughts
94	pos	I got it a week ago and so far I’ve experienced zero issues with it whatsoever but the double clicking problem usually doesn’t develop until later so if it does come up eventually, I will update my review
94	pos	The sensor is this mouse is legit, one of the best I’ve ever come across and I’ve used a lot of gaming mice in my life
94	pos	From Razer to Alienware, this one competes with the best of them
94	pos	The adjustable weights are also a plus
94	pos	I’m not hardcore on FPS so I don’t use them but they can come in handy for those of you who are into shooters
94	pos	The extra buttons are also a big plus
94	pos	It has a couple and they can be very useful
94	pos	The only downside I can think of is the mouse itself is rather a bit small for my taste and I think it could use a pinky support but I do have large hands so perhaps it isn’t applicable for everyone
94	pos	Also while it does have many extra buttons, the thumb one is awkwardly positioned right under the thumb so I frequently press it by mistake
94	pos	The two index finger buttons next to left click are also a bit inconvenient because one would have to move the index finger off the important left click to use them
94	pos	Conclusion: I got it on sale for $39
94	pos	99 and for the price it’s a fantastic deal
94	pos	At its full price of $80 however they may be better options but either way, it is a solid product
95	pos	I've always loved the Magic Mouse and can't give that up because of the multitouch features, but this mouse is so comfortable, and moves so effortlessly, I actually look forward to using it for gaming
95	pos	Once I got it configured for a particular game, it's actually improved my playing because of the multi-button functionality
95	pos	Moving functions to the mouse instead of trying to handle multiple actions at once on the keyboard has been a huge benefit, and has actually made the game more enjoyable to play
95	pos	Nothing can replace the multi-gesture functionality of Apple's Magic Mouse surface, but this is fully in use now and I really enjoy it
95	pos	It feels very solid and slides effortlessly
95	pos	I have a small hand that has no trouble reaching all the buttons and features, and its response rate is fantastic
96	pos	So, I'm finally retiring my Logitech G5
96	pos	It lasted this long, so why not choose another popular Logitech mouse, right
96	pos	Well, just the initial impression so far is not that great
96	pos	Starting with, right out of the box, the gliding material was not attached to the mouse
96	pos	The front pad was completely off, and the side and back surfaces were barely attached
96	pos	I saw another review with a similar complaint
96	pos	The first thing you want to do if you decide to buy this mouse is make sure those pads are in position and pressed down firmly to the mouse
96	pos	It's apparently an issue
96	pos	Next, your thumb should be as long as Jimi Hendrix's thumb
96	pos	The reach for the forward thumb button is pretty far
96	pos	I have pretty large hands
96	pos	XXL for gloves
96	pos	That button is way to far forward
96	pos	Finally, compared to the G5
96	pos	This thing feels really cheap
96	pos	The buttons are super flimsy
96	pos	The two main clicker buttons offer pretty much no resistance
96	pos	I certainly can't rest the weight of my middle finger on it without clicking it
96	pos	I don't know
96	pos	I guess I'm old and don't know how these new mice are supposed to be, but I'm really tempted to return it or give it to the kid
96	pos	Prime Day Sale made it fairly cheap
96	pos	Had I paid full price, I would be returning it
96	pos	Otherwise, I may update later after I use it a bit more
96	pos	No way it lasts as long as the old G5 though
96	pos	Update:Okay, so I've spent a few hours with this thing, and a few too many visits to Reddit to figure out some issues
96	pos	First, you need to download G Hub to run this mouse
96	pos	Which is fine
96	pos	The old Logitech software sucked
96	pos	Hard
96	pos	Although, I'm not sure yet that GHub is too much better
96	pos	First, it wants to do a firmware update
96	pos	So you accpet that and start the update, and it will sit there to the end of time saying don't uplug the mouse, it is updating the frimware
96	pos	If you don't see a progress bar after you start the update, you pretty much need to unplug the mouse and plug it back in
96	pos	That will immediately trigger the updater to kick off and it will update the software
96	pos	Next, you have two color zones you can adjust, and a page dedicated to do so
96	pos	You can have the logo and the DPI lights do two different color displays
96	pos	When you configure that, it shows what your mouse should be doing
96	pos	Yet, it won't be doing it
96	pos	For some reason, the DPI lights are not set to be on all the time by default
96	pos	So even though your picking colors and changing display types, it sits there
96	pos	dark
96	pos	The best part is, there is a place to set the DPI lights to be on all the time
96	pos	But they didn't put it on the page where you manage the lights
96	pos	Instead you have to click on the main "Settings" gear icon, and then you can select to have those lights on all the time
96	pos	I wonder how many mice get returned as defective for this
96	pos	Seems like if your going to have two customizable lighting zones, you would set the software to have those lights on all the time out of the box
96	pos	Dumb dumb dumb
96	pos	I will retract my comment about the forward button on the thumb
96	pos	That is apparenetly a DPI shift to let you quickly and temporarily change DPI
96	pos	That isn't that important for my puposes, so that button doesn't matter so much
96	pos	With that default function, probably best to have it out of the way
96	pos	As for the actually DPI adjustments, took me a bit to find them frankly
96	pos	They are contoured into the side by the index finger, they are both glossy and smooth, and by the time you figure out you are touching it, it is clicked and the DPI is changing
96	pos	I will get used to it, but again, some resistance and tactile sensation would be nice
96	pos	Glossy and smooth buttons are not great, and I keep accidentally dropping my DPI with that button location, and the fact it is so easily pushed
96	pos	Frankly, I liked how the G5 had the DPI adjustment behind the wheel, but this one has other stuff there which I will probably never use
96	pos	The center wheel
96	pos	Nice that you can have it smooth or notchy
96	pos	Notches are a bit aggressive, but maybe that smooths out
96	pos	Wouldn't mind if the wheel had some texture
96	pos	Maybe I'm the only one with calouses in this world
96	pos	Very hard to feel it, especially when it is set to freewheel
96	pos	There are slits cut across it, but most of the surface you are touching is smooth
96	pos	Long story short, with the software flaws, the loose gliding material, and the smooth buttons, I'm leaving it at a 3 stars
96	pos	I will say, I do enjoy the stock weight though
96	pos	It has extra weights, but it is right on for me weight wise out of the box
96	pos	And even though I had to adjust the gliding surfaces myself, it does move well
96	pos	I like that they softened up the cable from the G5 as well
96	pos	Still braided, but way more flexible
96	pos	Hopefully it holds up as well
97	pos	So, instead of writing a review shortly after I recieved the G502 Hero, I decided to wait until now so I could get acclimated to the mouse and keep an eye out for any potential flaws or issues with it
97	pos	First is the design:The design, while unusual, works fairly well
97	pos	I have small hands, but I'm able to reach AND use almost all the buttons
97	pos	Due to the placement, I do have issues reaching the G7 button without adjusting my hand to press it
97	pos	It may be possible to reach it with your thumb, but it's not easy to do
97	pos	The middle mouse button (MMB) is somewhat hard to press for me, mainly due to the required pressure needed
97	pos	It's considerably more difficult to press than any of the other buttons, even the other mousewheel buttons
97	pos	Though, all of the button functions can be swapped and changed, so it's definitely possible to assign MMB to a better-positioned button (like the DPI Shift button)
97	pos	As for the DPI Shift button, it's a little bit forward-placed for someone with small hands, but still easily reachable
97	pos	If you don't really change your DPI or need to change it on-the-fly, it's very useful as a G-Shift button or G3/MMB
97	pos	The G8 button is much easier to reach than G7, but it's not very efficient for some games
97	pos	In order to use it, you have to take your finger off LMB to press it, which leaves you temporarily unable to attack if you have LMB set to do that in whatever game you play
97	pos	Though, it can be used well to take screenshots with, provided you have a macro set up for it
97	pos	Second is the software:The Logitech G-Hub software does have problems, but it seems like those problems are at random and they don't affect everyone the same
97	pos	Though, unlike Razer Synapse 3, it will open at startup without automatically opening a tab for you
97	pos	It's pretty much in the background unless there's an update of some kind
97	pos	One of the big advantages over Razer is that the macro setup is much easier, as it's very simple to create a macro (for anyone not familiar with it, a macro is a programmed sequence of buttons/keys that can be assigned to another button and activate when that button is pressed, like Alt+Tab but assigned to a mouse button)
97	pos	All of the buttons can be reassigned via G-Hub, and drag-and-drop is the easiest way to do it
97	pos	G-Shift also works well, being the same thing as Hypershift, just rebranded
97	pos	(G-Shift is a feature of G-Hub/the mouse, which allows access to secondary button functions as long as you have G-Shift assigned to a button you have to hold down) Unlike Razer, RGB lighting profiles aren't available unless you're using a profile assigned to a specific game or program, so that's a downside
97	pos	Another downside is that G-Hub has issues scanning and recognizing games, as it only recognized some of my games, and then found a few more after a couple software updates
97	pos	Though, if you want to, you can add the games yourself, as that will work almost as well
97	pos	Third is the delivery:It didn't take long for it to get here, but that could be different in your area
97	pos	I ordered it on a Friday and it came the following Tuesday, on the exact day it was supposed to arrive
97	pos	Though, they will deliver it to your address specifically, as it seems PO box delivery is unavailable for this type of thing
97	pos	As you can tell, it did arrive in perfect condition, though that may be because of the short delivery time
97	pos	If you're interested in the G502 Hero, I would suggest that you give it a try, as it seems to be a fantastic mouse for me so far
97	pos	But, like I've mentioned, be aware of your hand size when buying this, as it may not fit your hands perfectly
98	pos	This is a fantastic mouse
98	pos	The buttons and even the scroll wheel are PERFECTLY clicky
98	pos	If you don't like that, the scroll wheel "click" can be turned off with the button directly under it, so it free spins
98	pos	You can also download it's user interface where you can download other users set-ups for specific games, etc
98	pos	and can built your own, along with setting up the "G" logo color palette
98	pos	The color vibrance and transition is so smooth and bright looking, I actually left it rainbow (my pics did not at all do the colors justice)
98	pos	The sides are rubberized, which provides excellent control for button use
98	pos	The 2 thumb buttons, 1 in front of the thumb rest & 1 above, and the 2 on the left button are extremely well placed, easy to use, but do not get accidently pushed easily
98	pos	The bottom is slighlt gridded for friction & the wire is covered in woven nylon & runs about 6 ft
98	pos	Oh, and it comes with a 5 pack of weights in their own case
98	pos	I couldn't be happier with this mouse
99	pos	I upgraded from Razer Basilisk (wired) and I would say, it is an upgrade
99	pos	Way better/more customization option, buttons clicks really good and overall build quality is awesome despite the cost of this mouse just being 40$
99	pos	Little plastic container contains multiple weights to weigh down your mouse is a surprise for me
99	pos	Those thing fits under discretely
99	pos	Now, there's one issue that has been really bothering me is the placement of G7 and G8 buttons mainly meant for upping and lowering DPI sensitivity into however many DPI stages you've added in G-Hub
99	pos	Placement sucks
99	pos	Left click is narrow and I can easily hit G7 and lowers my DPI sensitivity making me die, a lot while playing FPS such as Halo Infinite or while browsing through the internet I accidentally lower my DPI when I just want to casually browse
99	pos	If it was placed differently or had stiffer click to prevent accidents, then I wouldn't have any issues
99	pos	"But you can turn them off
99	pos	" Everyone has a different playing style and customization, I personally need them to adjust for whatever games I play so I keep accidentally lowering my sensitivity mid-game, it just ruins the moment
99	pos	Other than that issue, overall mouse is really good
99	pos	Like, actually good
100	neg	The weights are good but standard
100	neg	The resolution as expected
