115	neg	All these things have mechanically solid examples in your other products
115	neg	Paint the dang thing Gold, charge $80, and call it the "G399gg Great Golden Calf Edition"
115	neg	I don't care
115	neg	Just stop with these ridiculously over-designed "srz gam3r" fad features
115	neg	YOU
115	neg	ARE
115	neg	NOT
115	neg	RAZER
115	neg	YOU
115	neg	SHOULD
115	neg	BE
115	neg	BETTER
115	neg	THAN
115	neg	RAZER
115	neg	PS
115	neg	I purchased this mouse via a recommendation from a friend
115	neg	Whom (upon finding out only too late) never uses the mouse wheel, extra buttons or G HUB
115	neg	So yeah, 5-Stars if you just want an overpriced 2-button Mouse
116	pos	Good well made mouse
116	pos	Packaging and shipping was excellent
116	pos	I had to give this mouse away though because it is just too large and uncomfortable for my hand size
116	pos	I also would prefer more buttons
116	pos	Size :I found the back of my hands hurting after using the mouse
116	pos	The "hump" or curve of the mouse seems high, making it a reach for the far left side button (default aim)
116	pos	This means I likely would not use it, bringing the amount of extra buttons down (at least for me)
116	pos	Although, my fingers did seem to automatically find the perfectly located middle back button
116	pos	I never once hit the front middle accidentally
116	pos	Perhaps because one button was too far and just the sheer size of the mouse, i did find that my fingers would sort of expect the four left buttons to be far as well, causing me reach further then they actually were and mis-press
116	pos	To be clear, those four and the middle back buttons are perfectly located so this is just me
116	pos	Buttons:The amount they state does not include the middle front button which serves as the switch for your scroll wheel (either free rolling or click
116	pos	both are great
116	pos	)
116	pos	While I like the option to choose this, I world have prefered having another mappable middle button like my current device
116	pos	Two of the mappable buttons are your scroll wheel left and right tilt
116	pos	This is cool but I felt it would have been better with more noticeable feedback like a soft click
116	pos	The wheel felt almost loose and I am curious if I would have ended up mistakenly clicking to the left or right while trying to just middle click
116	pos	I honestly think I wouldnt and it's just a matter of the user to get used to it
116	pos	Overall, a cool looking and good quality mouse with a few expertly placed buttons
116	pos	Just a bit too large and would have liked more buttons since one of them becomes semi unreachable
117	neg	**Updated review**Amazon replaced the mouse because Logitech was being difficult about honoring their warranty
117	neg	So the 2nd mouse had the same software issue as the original review but I had found a work around for the custom key assignments by using registry edits to let the mouse work with the older software
117	neg	Unfortunately this 2nd mouse has now developed the double click problem that many Logitech mice are prone to because they use cheap micro switches for the clicking mechanism
117	neg	Honestly I'm just going to switch to a different brand that uses better switches even though I've been using Logitech mice for over 20 years
117	neg	**Original review**I upgraded from an old G502 spectrum to this mouse
117	neg	FIrst of all the good things, it's of good quality construction and fits extremely well in my hand
117	neg	It slides fairly smoothly over my mouse pad and overall it's a pleasure to use
117	neg	The bad
117	neg	It is not compatible with Logitech Gaming Software and instead needs to be used with G-HUB in order to customize it's settings
117	neg	G-HUB is
117	neg	not so good
117	neg	G-HUB prevents the left/right wheel click from continuous horizontal scrolling like I could with the G502 Spectrum on LGS
117	neg	(not to be confused with the vertical scroll wheel)I can't assign custom key assignments to the mouse while using onboard-memory mode, it only works when onboard-memory is not turned on
117	neg	You can create a custom profile and then assign it to one of the 5 memory slots, but custom key assignments are for some reason not saved and/or applied
117	neg	What's the point of allowing 5 custom on-the-fly profiles to be assigned if they are not going to let you use custom key assignments
117	neg	It's one of the main features if the mouse that simply won't work because G-HUB doesn't work properly
117	neg	Logitech should enable compatibility with LGS or fix G-HUB
117	neg	Honestly I wish I could just get my money back
118	neg	Here's the bottom line for this mouse
118	neg	It's got average ergonomics, above average buttons and placement, but is spoiled by the terrible Logitech GHub software
118	neg	This mouse doesn't have any onboard memory, which means the Logitech software *has* to be running at all times for you to use anything but the basic functions
118	neg	If it closes on you (which
118	neg	it will), you immediately lose any functions you've set on those extra keys until you reopen the software
118	neg	I use this mouse on both my Mac and PC
118	neg	The interface is poorly designed, and I've yet to have it detect different games when they run on my PC
118	neg	The Mac software has even reset itself a couple times in the 3 weeks I've had it, meaning I have to go back and remap everything, reset the mouse speed, etc
118	neg	Also beware, Little Snitch shows that the G Hub software does phone home to Logitech
118	neg	You can't be sure what it's sending back and forth, especially when you're required to give it full access to your machine for it to function
118	neg	To cap it off, Logitech has *specifically* designed the extra buttons on this mouse so that they cannot be detected by any software other than G Hub
118	neg	Typically you could use an alternative like USB Overdrive or Steermouse on Mac to map buttons, but that's not an option
118	neg	To be clear, that is a deliberate design choice by Logitech to lock you in to their awful software
118	neg	I'd strongly recommend looking elsewhere for a mouse
119	pos	I got this mouse to replace my Razor Naga and my Predator(buttons quit working) for FPS
119	pos	My favorite aspect of the mouse is the adjustable weight
119	pos	i like my mouse to be heavier and i was pleasantly surprised that it came with quite a bit of weight i could add to it and make it the perfect weight
119	pos	The RGB lighting customization for the mouse is great and the software is super easy to use and that's where you can set your custom DPI and use the button on the mouse to quickly switch between the settings
119	pos	The one thing I don't like about the mouse that I've gotten used to is the size, my hand dwarfs this mouse
119	pos	Don't get me wrong its a decent size mouse but i have rather large hands so it was an adjustment but now after about 2 months of using it it feels natural and works great
119	pos	I would recommend this mouse to someone who is looking for a good FPS mouse that wont break the bank
119	pos	Fast forward 9 months the thing quit working
119	pos	Took it apart and the right click switch metal piece had broke and won't work anymore
119	pos	That little metal piece bricked the whole mouse
120	pos	I bought this mouse knowing about the double clicking problems plaguing Logitech mice
120	pos	Whether I come to regret this remains to be seen
120	pos	That said, I purchased the protection plan since everything I have heard about this mouse lead me to believe that it will fail within a few years
120	pos	Design flaws/QC defects aside, I really like this mouse so far
120	pos	It has a bunch of features not present on other mice, like the infinite scroll wheel, left and right scroll buttons on the scroll wheel, programmable profiles, and the button to temporarily change between DPI settings within a profile when held
120	pos	I'm not terribly keen on the shape of the mouse, but I'm getting used to it
120	pos	I don't like the nylon braiding on the wire
120	pos	I liked the cloth braided wires on older mice better
120	pos	Yes, they were prone to kinking over time, but that's just my personal preference in the end
120	pos	The customization software is fairly simple, but some features are easier to adjust than others
120	pos	No documentation on the software in the included instructions, but it's easy to figure out how to use it given a bit of time
120	pos	If it wasn't for the double clicking issues plaguing these mice I would say this is a solid 4
120	pos	5-5 star product, but knowing how widespread they are I'm giving this a 4 star rating instead
120	pos	This review is based on my experience so far
120	pos	If the mouse fails I will return and revise this review along with information on the RMA process
121	neg	EDIT: Beyond the minor difficulties in my original post, the software this comes with doesn't switch profiles when you're playing a game
121	neg	After spending an hour on Reddit trying every suggested fix, none of them have worked - it always reverts instantly to the default "Desktop" profile
121	neg	Really regret buying this mouse, should have stuck with Corsair
121	neg	It's a great mouse, a 5-star mouse, except for how loud the scroll wheel is
121	neg	I can't tell if I got an especially loud one, or if other people just don't notice the noise, or what, because every time I use the scroll wheel it's SO loud that I'm debating whether to keep using this mouse or not
121	neg	Hoping it'll get quieter over time because it really is a great mouse otherwise
121	neg	Just so, so, so very loud
121	neg	(You can switch between regular scroll and hyper scroll, and hyper scroll is totally silent, but it's also far too imprecise for me to use for most things
121	neg	If you're only looking for hyper scroll the noise wouldn't be an issue at all
121	neg	)
122	pos	A fine mouse it is with a lot of very nice settings and profiles that i find to work nicely
122	pos	I do think the sides are a bit slicker than i would prefer and if stickier/grippier might help with the narrowness
122	pos	As a fella with wider hands I find it to be a bit narrow with my pinky and other finger dragging the mat and I find it to be pretty low profile
122	pos	I think if you had smaller hands or likes a thinner and low profile mouse this is perfect
122	pos	If you have bigger hands and want a larger mouse I would look at the Anker precision gaming mouse, I will get another to replace my older one and give this nice mouse to my wife or daughter
122	pos	I like this mouse alot just wish they had an XL version
122	pos	BTW, the mouse wheel does not break it has a button to click rotate or free fly
123	neg	EDIT2 10/23: drifting has become way more noticeable
123	neg	This for MSRP of $80 is ridiculous
123	neg	Usually go Logitech, but it's time to try other miceEDIT: I thought I was going crazy, but my mouse has begun to drift on its own
123	neg	It's been getting worse and worse
123	neg	I don't even use this for gaming really so the durability is questionable
123	neg	I love the G602 and, besides the wireless version of the G502, the G502 wired is the closest thing to the G602
123	neg	The mouse clicks feel nice and sound quiet just like the G602
123	neg	The build quality is great and it doesn't feel cheap
123	neg	However, my biggest complaint about this mouse is that it does not have the same amount programmable buttons the G602 had
123	neg	It's a step backwards from the G602 in this regard and it would be amazing if more buttons were positioned on the left side of the mouse like the G602
124	pos	tl;dr: I have big hands, the mouse is too tapered for my palm grip and is uncomfortable
124	pos	This mouse is better for claw grips
124	pos	It's a cool mouse, but not for me
124	pos	If only the back end was thicccc enough or my palm
124	pos	I have large hands and from a diagram I was researching it was supposed to be one of the more larger sized mice
124	pos	7
124	pos	5" (~19cm) Middle to Base of Palm x 4" (~10cm) across (from the base pinky joint to index joint)
124	pos	I bought this to replace my Razer Death Adder which is far more comfortable
124	pos	I thought the Hero 502 felt narrow
124	pos	Hero 502 measures ~60mm across as the gripping area, but so does the Death Adder
124	pos	I think the problem is attributed to to the narrow tapering base where your palm sits
124	pos	On the 502 Hero, there is only about ~60mm in diameter at the base, but it's tapered so much near the top, there is almost nowhere for your palm to sit on
124	pos	(I like my palm grip when I'm aiming with my arm
124	pos	)
124	pos	In Comparison with the Death Adder at around ~73cm in diameter, my palm sits comfortably
124	pos	I've had a couple Razer products and I want to go try other things now
124	pos	The current DE Chroma, somethings are wearing off/out
124	pos	So it's time for a new mouse
124	pos	Nitpicks: The scroll wheel is more like a flywheel
124	pos	I don't want that much momentum when I flick that wheel around
124	pos	I do like the idea of tilting the wheel, cool feature
124	pos	Another nitpick is Ghub, I'm not familiar with it, but it did take a while for me to set up the DPI
124	pos	And man that was down a couple of rabbit holes
124	pos	I didn't realize GHUB had profiles for each game you had (Which can be a cool thing, but I was hoping the Desktop default was the global set for everything unless you manually change a profile for a game
124	pos	Last nitpick about GHUB, if you have a library of games, you have to keep clicking over this long horizontal list of icons
124	pos	Come on, why can't we set these to tiles of some sort
124	pos	Or just a line by line list of games
124	pos	Or a choice between all three
125	pos	PROS-Cool lights-Fits ergonomically, with adjustable weights-Lots of customizeable buttons
125	pos	For editing, I use a lot of Ctrl functions like Ctrl C, CtrlV, CtrlZ, and CtrlS, so making them each one click streamlines things a great deal
125	pos	CONS- Software is very glitchy and bloated
125	pos	Takes up a lot of memory just to assign a few buttons
125	pos	Sometimes the button assigns just reset to factory after a while
125	pos	Had to reinstall it
125	pos	-The mouse wheel is one of those free-spinning ones that you can either spin like a fidget spinner or lock into a more traditional motion
125	pos	After two months of web-browsing use, the scrolling action no longer registers accurately
125	pos	Clicking with the wheel works, but scrolling up and down has about a 20% success rate
126	neg	My proteus g502 started doing the dreaded double click after a few years so I pulled the trigger on this new "HERO" version of the g502
126	neg	I didn't know it at the time but if you buy a mouse with one of these new "HERO" sensors you will no longer be able to use the sensor/surface calibration that comes with LGS
126	neg	Logitech claims that this new "HERO" sensor does surface calibration on the fly and thus you can no longer manually calibrate it
126	neg	I've been using the mouse for about 24 hours now and its almost completely unusable even for regular web browsing, constant stuttering and deadspots
126	neg	I am using a good quality black neoprene mouse pad with a clean surface
126	neg	My g502 proteus used to do this as well but a quick surface tuning would easily resolve the problem for 6-12 months
126	neg	I found a tip online to uninstall the virtual mouse driver and reboot, this seems to have worked for a few hours but now the problems are back again
126	neg	Don't buy this "HERO" version, get the proteus version if you want a g502 (which is now twice as expensive as this mouse and more expensive than it used to be - gee i wonder why)
127	pos	I've used Logitech Mice for several years now
127	pos	I lost my old Logitech Mouse in my move to another state and I needed a replacement I bought the wireless lightspeed mouse
127	pos	It started having double clicking issues, and I ended up chucking it
127	pos	I decided to go with the standard wired mouse, and I saw the Logitech G502 Gaming mouse with the hero sensor
127	pos	It was cheap so I bought it
