100	neg	Button presses require very little force (I would bet the switches would be the first things to fail)
100	neg	Update few months later: docked two stars, left button has developed switch bounce and now sometimes clicks multiple times with one press of the button
100	neg	Update months laterer: Oh man, you're gonna love this
100	neg	Button got worse (couldn't even drag anything; real fun playing the "which folder did the file get dropped into
100	neg	" game) then the right button started to display similar issues
100	neg	Logitech did send me a new one, buuuuuut
100	neg	It took me a month or two to actually get the warranty process started and it's a huge hassle
100	neg	Even once the warranty process starts and someone actually contacts you, it's only to give you a many-steps email to get you to do the troubleshooting for them (including removing their own software which makes sense as it's basically malware; it's bad)
100	neg	They make you, no joke, record a video of you clicking on a website they send you to with:- the mouse visible,- the website url visible,- the "double click counter" visible, AND- a HANDWRITTEN NOTE with the ticket number written on it
100	neg	If you can jump through all those flaming hoops and prove that, indeed, the issue you said it had (months ago) was really real they're going to have you then take a picture with:- the mouse visible,- the S/N visible (and it has to be the one on the product, not the box), AND-
100	neg	ANOTHER handwritten note with the S/N and the ticket number written on it
100	neg	I'll be honest, I expected them to next request I take a picture of myself holding the mouse with the ticket number scratched into my forehead while holding a newspaper like some sort of kidnapping victim
100	neg	They didn't ask for that, however; instead, they asked for all of my details and sent me a new one
100	neg	So, in summary:- they replaced defective product and I love being able to drag files or select text again, that's one (1) shiny gold star for Logitech added
100	neg	- they made the process so painful I'd rather have a cage-match with a gang of feral cats all hopped up on catnip and PCP than go through it again, TWO STAR: MINUS  >:-[If yours develops any issue at all during Amazon return/replace period, do it before that time runs out
100	neg	Interestingly, they don't even seem to want the mouse with the bad switch back, which would be an easy/cheap fix
100	neg	I thought they made me go through all that 'cause they're so expensive to make or something, heck they already spent a lot of money on labor hours, but
100	neg	nope
100	neg	That's right, the expensive (well
100	neg	more than $10) mouse they want you to perform 3 miracles to replace isn't worth shipping that tiny box over
101	pos	Generally, you hear a lot of good things about Logitech mice, but this one might possibly be the best one from them
101	pos	Between being able to customize the other buttons on your mouse, on top of your DPI, but it also has an unlockable mouse wheel
101	pos	Scrolling through a big inventory, or a long thread online
101	pos	Unhinge that bad boy, blare some eurobeat, and rip your finger off of the wheel
101	pos	The wheel itself is comfortable, and really sturdy when you're clicking, or even scrolling
101	pos	The other buttons don't get in the way of your clicks, and the wheel lock is completely out of the way when you're using it
101	pos	The only (probably personal) issue I have so far is, my mouse does glitch out, and moves either in one direction, or spasms
101	pos	I don't have any dust, nor debris on my mouth, so I'm unsure if I have a faulty mouse, or it could be one of those model-specific issues
101	pos	Regardless of that, this is a really nice mouse for its price
101	pos	The firmware is great (not needed), the mouse is comfortable, and if you're a fan of weighted mice like I am, it has a sizeable, adjustable weight you can fit inside
102	neg	Have gone through two of these mice already and same issue both times
102	neg	After about a year the mouse will cause the camera to look straight up and the M2 (right click) button completely gives out
102	neg	Good luck playing any FPS game without rage quitting when this inevitably occurs
102	neg	Its disappointing because brand new, the G520 Hero is a great gaming mouse
102	neg	It fits nicely in the hand, has adjustable weights, and the perfect number of buttons for most gaming styles
102	neg	Would love to purchase another but can not justify throwing more money at Logitech for a product I know will fail within a year
103	pos	The G502 is replacing two faulty Corsairs - the M65 Pro RGB and the Harpoon RGB
103	pos	Both are having typical left click failures, so I wanted something heavy with a larger footprint like the M65
103	pos	Logitech got a lot right with this design, which is why I'm not surprised it hasn't changed much over the years
103	pos	The ability to add weights is a huge plus for me since I love a large, heavy mouse for some weird reason
103	pos	The magnetic flap is one of my favorite design choices as well - it's dead simple and honestly really cool
103	pos	The scroll wheel is solid and tactile, and provides a rewarding click when using
103	pos	With the scroll button disengaged, the scroll wheel is buttery smoooooth
103	pos	I definitely dig it, especially because this mouse pulls double-duty between my gaming PC and my work laptop
103	pos	Honestly, the only issue I've found is that DPI switches positioned essentially on the left click (G7 and G8) can prove to be an annoyance if you miss the click and unintentionally increase/decrease the DPI
103	pos	I think this issue is mainly on me, though
103	pos	I change up my grips periodically, so it's really just acclimatizing to the mouse at this point
103	pos	Overall, I really dig the G502
103	pos	I've always avoided Logitech products because of their "office" products, but this mouse has definitely exceeded my expectations so far
103	pos	Since I'm still breaking it in, I'll probably update this review if it starts doing anything wonky
104	pos	I am having tracking issues with mine
104	pos	It's mainly my table to blame, but my Razor mouse don't have a problem with my desk and mouse pad
104	pos	The software does not allow me to calibrate my sensor for my mouse pad nor does it let me adjust the lift off distance like Razor software can
104	pos	My table is plastic table and the weight of my pc and monitor bow the middle of the my table causing a sunk in effect
104	pos	My table also has ripples / waves you can feel with your hand when you slide across
104	pos	The mouse pad I have hides the ripples to some degree
104	pos	So this mouse not taking a liking to this and thus not working out for me
104	pos	But when using it, you can feel it hang on something and stop moving for a sec
104	pos	My Razor mouse does not have any issue
104	pos	You can glide my Razor mouse across gravel and it still make head shots
104	pos	But this mouse not working for me
105	pos	I got this to replace a Logitech G403 Prodigy that I've had and enjoyed for 3yrs but recently developed a failing left-click switch
105	pos	I got this instead of another G403 because it was a little cheaper, apparently "the most popular gaming mouse", and has more buttons (though I don't think I'd really need all the extras)
105	pos	Two issues immediately stood out
105	pos	First, my ring finger has a place to rest on the right edge of the G403, while this mouse doesn't quite have room for it, so I'd need to modify my grip to either squeeze it on with my middle finger, or drop it over the side
105	pos	It probably wouldn't be a huge deal in the long run, but I noticed the difference in ergonomics right away
105	pos	Second, and the reason I chose to immediately return the mouse and order another G403 (a HERO this time, because that's what's available) is the scrollwheel
105	pos	The G502 scrollwheel has a slick metal surface that's almost slippery, and a LOUD clicking in step-mode
105	pos	The button for switching to smooth scrolling is a nice feature, but in step mode it's just too clunky
105	pos	By contrast, the G403 has a rubberized wheel surface that requires very little force to use and light detents that silently provide just the right amount of feedback for stepped scrolling without adding appreciable resistance
106	neg	I had an iBuyPower mouse that lasted me six years I got for $11 at a thrift store
106	neg	This g502 Logitech Hero hasn't even lasted me two years
106	neg	I was waiting to review this for this purpose
106	neg	I'm now back to using the thrift store mouse because the g502 Hero is no longer functioning
106	neg	The upside: The mouse feels nice and glides effortlessly across most surfaces
106	neg	It is comfortable
106	neg	Primary Issues: Comfort is about all this piece of junk has going for it
106	neg	Left click doesn't double click all the time, and actually stopped "clicking" a few months into use so now I just have to guess since there is no audible click or touch-sensory click
106	neg	The right click doesn't work at all most of the time and that's important for some games and functions I use on my computer, so I have to use my other mouse entirely for that purpose
106	neg	Glider Wheel broke several months in
106	neg	I was able to fix it by cleaning it out the first time, thinking it was just general build up or something, but the second time the button which allows you to utilize the smooth wheel versus the click wheel went out, and any time I try to up-scroll it doesn't register as a scroll and instead registers as me clicking the wheel
106	neg	Again, the right click stopped working
106	neg	It still clicks, I can feel it, I can hear it, but the mouse doesn't react
106	neg	I disassembled, cleaned, reassembled and still nothing
106	neg	Unreliable DPI stability feature
106	neg	Sometimes my DPI will drop well below acceptable usability, then recover on its own
106	neg	The entire software setup, this gHub or whatever, is absolute garbage
106	neg	Completely
106	neg	Ridiculous
106	neg	Trash
106	neg	It is a convoluted mess requiring so much more work than is necessary to use
106	neg	It crashes for no reason despite updates, does not save profiles, does not let you utilize macros, is not user friendly, and requires manual startup
106	neg	If you click to open it, it just sits on the "Update" screen indefinitely
106	neg	There are too many other things I want to say about this product, but overall, and being a lifelong fan of Logitech, I'm more than disappointed
106	neg	This is the second g502 Hero I've bought (the one I bought from Amazon was New/Unused) and to be quite honest I'd rather go through another company than deal with these issues anymore
106	neg	I won't be using their "gaming" mice ever again
107	pos	Someone said this is too heavy
107	pos	I don't think it is
107	pos	It's lighter than my old gaming mouse that broke
107	pos	It has too many buttons and some are near the primary ones
107	pos	You have to be careful how you hold your hand or you find yourself changing your sensitivity by accident
107	pos	Logitech's cancerous G-Hub program is required to set it up initially, but once you set the onboard memory it will work without it
107	pos	G-Hub did not work on Win 7 for me, and there's no Linux support
107	pos	You will need Windows 8+ to configure it
107	pos	I feel we're going backwards in technology and user experience here
108	pos	About a year ago I decided to get back to PC gaming
108	pos	I had started streaming and after mostly PS4 content with an underwhelming laptop to boot, I upgraded to a desktop last year which came with a good “gaming mouse”
108	pos	It was comfortable to use so I never put much thought into it
108	pos	About a month ago I decided to look around for a mouse though to see if it was even worth upgrading, talked to a few friends and they all recommended the G502
108	pos	I’ve known the Logitech brand for quite a few years and have used their cheaper wireless mice for my laptop so figured I’d give this one a shot
108	pos	And holy cow is this an awesome mouse
108	pos	The customization features in the Logitech Software alone is super easy to use and make adjustments for later
108	pos	Set different levels of sensitivity for my needs, set up the extra mouse buttons for different purposes in different games
108	pos	I’m still struggling to adjust to a mouse and keyboard after having a controller in my hands for almost three decades, this mouse has greatly assisted in my transition into the PC world
108	pos	Console gamers looking to dive into PC, give this mouse a shot, it has enough customization options to fit just about anyone’s needs
109	pos	I have/was a Razer fanboy for years
109	pos	Unfortunately razer products have started to go downhill & any support has become virtually laughable if best
109	pos	This isn't a crap on razer review but more a "thank god I found an alternative"
109	pos	When switching from my 3rd razer death adder to my first logitech G502, I immediately felt "comfortable"
109	pos	Added weights gave me the feel I wanted
109	pos	The ergonomics felt right, & the mouse overall just WORKED
109	pos	I am a huge fan if the scroll wheel now also & the fact that you can set it to both standard & infinite scroll is a nice touch
109	pos	Been several months now & I think it's time I make the complete jump for the rest of my products
109	pos	My current keyboard now randomly changes audio & phantom types keys from time to time
109	pos	Not something you want while gaming
110	pos	This is an extremely precise and reliable mouse, both with movement and scroll wheel
110	pos	The only annoying thing about it is the non-adjustable "thunk" of the scroll wheel, it's too "notchy"
110	pos	You can engage/disengage that notch, but:- if you disengage it, the scroll wheel becomes too sensitive, the slightest touch and it scrolls
110	pos	- if you engage it, the scroll wheel has a super annoying "thunk" every time you turn the mouse wheel
110	pos	becomes extremely precise, but super annoying (feel and sound)Tried the MX3 before this one -> the MX3 was better built, had a better scroll wheel feel, but was glitchy every so often (the scroll wheel was precise only ~99% of the time, couldn't find a way to get rid of that glitchiness in their "Logi Options" software, tried all possible settings/sensitivity)
110	pos	In the end, I went with the razer basilisk -> extremely precise, scroll wheel sensitivity can be adjusted with a knob under the mouse (no software needed
110	pos	- I hate having to install mouse/keyboard software, for any reason)
111	pos	This is competing with the g300s for my favorite mouse
111	pos	Buttons: It has enough buttons to assign several functions to them in games without going overboard
111	pos	I really wanted a mouse with extra buttons directly adjacent to the M1 or M2 button like the g300s had and this one has two next to the M1 button and a couple of thumb buttons
111	pos	Weight: Medium to heavy depending on weights added
111	pos	There is a hinged magnetic "door" on the bottom of the mouse that makes it extremely easy to adjust the weight of the mouse on a whim
111	pos	My g300s was ultra lightweight, which made flick shots extremely easy but glidey tracking wasn't perfectly smooth
111	pos	This one glides extremely well and flicks well with the weights taken out
111	pos	Adding too much weight can cause overshoot or a kind of rubber banding effect when I throw my hand quickly, but more weight feels like it has easier gliding and tracking
111	pos	Features: This has things like profile shifting and a temporary dpi shift "sniper" button but I never use those
111	pos	It does have a scroll wheel lock and unlock button that lets you choose between the clicky single line scrolling or the friction free high speed scrolling, which I change all the time as needed
111	pos	Usually for browsing
111	pos	Software: Let's you change your lights, button assignments, make macros, etc
111	pos	The usual
111	pos	Cons: The only minor con is that the scroll wheel very slightly jiggles when flicking the mouse quickly
111	pos	It has never caused me problems, but I can feel it when it happens
111	pos	I fixed it by using a thin nylon washer with a slit cut in it so I could lower it on the "axle" the scroll wheel is attached to
111	pos	The jiggle was nearly eliminated and the friction free scrolling still works fine
112	pos	I really wanted to love this mouse
112	pos	I am a casual gamer, and I thought this would up my game a bit with precision and programmable buttons, etc
112	pos	Sadly, after using it for an afternoon, I found to be a poor choice for me
112	pos	Pros:-The smoothness of the sensing is excellent
112	pos	I felt my ability to pick precise targets in shooting scenarios would be enhanced compared to my old Microsoft mouse
112	pos	-The ability to switch the scroll button to free-wheeling is handy and satisfying
112	pos	-Materials do seem to be nice and solid
112	pos	-The weights are a nice touch for customizability
112	pos	-The lights add visual appeal without being too flashy
112	pos	Colors are customizeable
112	pos	-The quantity of buttons available is good, and their locations are easily accessible by fingers without accidental touches just from gripping the mouse itself
112	pos	-The sliding surfaces on the bottom are smooth and large
112	pos	-The feel in my larger than average hands was nice
112	pos	Ergonomics were good compared to a more standard shape
112	pos	-The thumb button for engaging low DPI would be good if I could get used to it
112	pos	-The multiple profiles available for single or multiple customized DPI & programmed button settings is nice
112	pos	Cons:-There's too much resistance on the scroll wheel when free-wheeling is disengaged
112	pos	When my fingers were dry, they would actually slip on the metal wheel surface instead of rolling it
112	pos	-The left/right bump buttons on the scroll wheel are easy to press, but the center scroll button is hard to press
112	pos	I found it very difficult to consistently press only the center scroll button
112	pos	Most of the time I was accidentally pressing down and left or right at the same time
112	pos	-My habit of wedging my thumb against the mouse pad and mouse for extra precision is not possible with this mouse due to the ergonomic wing shape on the left side
112	pos	I found this highly annoying, and it made it harder for me to hit targets
112	pos	If I could get used to toggling the DPI on the fly, this might be ok, but for $50 I don't want to work that hard to love it
113	neg	I don't write reviews much but look another way for a gaming mouse
113	neg	The left click works when it wants too
113	neg	I play FPS shooters and much other games, but the clicks have been giving me issues
113	neg	When ADS in FPS shooters, it's like the mouse is in rapid fire or its to sensitive with clicks and acts like a double or triple click and this is really annoying in gaming or even casual use as when you try to drag and drop or click on a folder or app it will double or triple click most of the time
113	neg	I would've returned it but its been sometime
113	neg	Not sure if I would get another Logitech mouse as I've been let down twice already
113	neg	The other products they make are great but the mice in my experience are terrible
114	neg	I just wanted a simple mouse for a cheap price but I guess you get what you pay for
114	neg	I’ve had good luck with Logitech products in the past so I figured this mouse would be decent
114	neg	There’s not a lot of good, long-lasting gaming mice on the market anymore and I was worried about spending too much just to have them stop working in a couple months
114	neg	This one was great at first and appeared to work just right, and didn’t give me the dreaded double-click issue I had with previous gaming mice but after a month, the cursor started to do its own thing
114	neg	It would randomly drag itself across the screen and freeze and I’d have to unplug and re-plug-in the mouse to my computer in order for it to start up again
114	neg	Super annoying after the first two or three times and it began doing it more often as time went on
114	neg	I thought it was a computer issue but it did the same thing on other devices
114	neg	I ended up getting a different mouse recently
114	neg	This one is not worth buying
115	neg	G502 Hero Mouse from Logitech, Review
115	neg	I've been buying the "Inferior", non-"sick
115	neg	" G300s several years
115	neg	I've owned owned a total of three G300's
115	neg	Even though the G300s physically decay like cake in the rain, I strongly recommend buying a G300s instead of this G502 piece of absolute garbage
115	neg	LET ME EXPLAIN:To start, the Hand-Feel for me is really bad, and I usually end up holding it in a way that makes reaching two of the Thumb buttons very awkward
115	neg	I normally get Ambidextrous mice , so that's my fault
115	neg	And really, it's also my fault for having strange hands
115	neg	But that's not what makes the G502 the worst mouse I've touched in over a decade
115	neg	NEGATIVES:What is NOT my fault is the overly sensitive Click Pressure on all the face and side buttons
115	neg	I don't know if that's an intended feature, or I just got mouse from a lot that was over-tuned
115	neg	But it's far too easy to accidentally click when sliding the mouse across the pad
115	neg	ANY resistance from your surface and CLICK
115	neg	Glance any part of a button that isn't the exact center: CLICK
115	neg	Gently feel for where the buttons are in the dark, while being careful to use far less force than should reasonably be needed to depress a button far enough to engage the mechanism : CLICK
115	neg	CLICKCLICK
115	neg	CLICK
115	neg	MORE NEGATIVES:The Mouse Wheel has to be some cruel experiment in psychological warfare
115	neg	The Lock/Unlock implementation warrants detailed comment in both states
115	neg	Beyond the fact that it is an unwanted feature at the best of times -- when gaming, it will actively hinder your enjoyment and performance -- unless you dedicate your life mastering it, and I have no intention of doing anything remotely close to that
115	neg	* As a free spinning wheel, it fails due to floatiness
115	neg	Unless you just want to rip-scroll through several pages of product reviews on Amazon to record for a video project, it has no use case that is superior to any other scrolling function available to users, and that includes the Middle Mouse Button scrolling that the mouse still possesses (I'll get to MMB issues later)
115	neg	* As a tick wheel, it FAILS because the ratchet is far too loose to be trusted
115	neg	You get this awful effect where physically, the wheel will "back rock" or fore rock" to cradle itself between the teeth
115	neg	This then causes your scroll selection to tick up or down onto something other than your intent
115	neg	Not always, mind you
115	neg	But enough (and unpredictably so) to seriously impede, if not, ruin whatever gaming moment you might have been having
115	neg	Further exacerbating the issue is you cannot change the internal DPI of the mouse wheel sensor
115	neg	Not with your OS, not with G HUB, not with ANYTHING
115	neg	You can only change how your Operating System MULTIPLIES the Wheel Motion
115	neg	And even with a 1:1 multiple, you get that selection rocking issue
115	neg	And anything LESS than 1:1 results in no scrolling whatsoever unless you unlock and rip-scroll
115	neg	MOAR NEGATIVES:Oh and this is all before the issues of trying to get a clean Click out of the Middle Mouse Button buried under this infernal, Chroenburgian assembly
115	neg	It feels like trying to command a Two year old into behaving, using only soft verbal warnings, while sliding supine across a frozen lake, while also being used as hockey puck by competing teams of various drunken Canadian bears and moosen
115	neg	This would be an absolutely great mouse to lend to your competition
115	neg	if this was the design intent, hat's off to ya
115	neg	But, to put everything I've said even more viscerally
115	neg	I want to rip the wheel out of the mouse with my teeth and grind it until my gums bleed
115	neg	It's rare that I'm passionate at all about a design feature
115	neg	But this wheel, I HATE IT
115	neg	I want the person who designed it to feel as bad about making it, as I do trying to use it
115	neg	NEVER REVISIT THIS DESIGN EVER AGAIN
115	neg	You just don't get it
115	neg	It literally adds a layer of anxiety and distrust to EVERY SINGLE THING done with this mouse
115	neg	Even the tasks that have nothing to do with scrolling at all
115	neg	The fact that you know this boobytrap is a centimeter from your finger is all it takes
115	neg	Oh yeah
115	neg	AND IT'S LOUD
115	neg	It doesn't even have the common courtesy to make a satisfying noise
115	neg	NO
115	neg	Shifting a from 4th Gear to Reverse at Highway speed in your uncle's rustbucket Camaro is less audibly jarring
115	neg	POSITIVES:The software is actually fairly good
115	neg	With the caveat that you cannot change the Wheel DPI nor the Wheel Up/Down command assignments (wth
115	neg	)
115	neg	The Motion is spot on, but that's baseline expectation for a +$50 MouseAnd the Weight system is a fine option, even if I'm most comfortable taking all the wrights AND THE DOOR off
115	neg	CONCLUSION:The G502, in my humble opinion (at least THIS one I personally received) may as well be eWaste
115	neg	I genuinely tried "Getting Used to It"
115	neg	I gave the thing several months
115	neg	But as a result, I can no longer return it
115	neg	Seriously, Logitech
115	neg	If you would just use the G502's Software, Motion Sensor and Moulded Plastic Quality for the next iteration of the G300s series: I'd buy that day one
115	neg	Give the next G300s a SOLID wheel with a strong ratchet and Side-Pivot lateral scrolling
115	neg	You could even toss in a Thumb Toggle/Switch for DPI shifting or whatever
